"Status","Start Time","Stop Time","Duration in ms","Parent Suite","Suite","Sub Suite","Test Class","Test Method","Name","Description"
"passed","Fri May 16 08:41:41 GMT 2025","Fri May 16 08:41:41 GMT 2025","2","MeilisearchService","formatTourForIndex","","","","should correctly format a tour for indexing",""
"passed","Fri May 16 08:41:43 GMT 2025","Fri May 16 08:41:43 GMT 2025","5","PreRegisterService","validateLogin","","","","should validate login ticket and return access token",""
"passed","Fri May 16 08:41:41 GMT 2025","Fri May 16 08:41:41 GMT 2025","4","ItineraryService","createItinerary","","","","should handle non-consecutive block positions when creating routes",""
"passed","Fri May 16 08:41:45 GMT 2025","Fri May 16 08:41:45 GMT 2025","3","PaginationDto","","","","","should transform page to a number",""
"passed","Fri May 16 08:41:41 GMT 2025","Fri May 16 08:41:41 GMT 2025","2","MeilisearchService","calculateDaysCount","","","","should calculate days count from date range",""
"passed","Fri May 16 08:41:41 GMT 2025","Fri May 16 08:41:41 GMT 2025","2","ItineraryController","findMyCompletedItineraries","","","","should return empty itinerary array if no completed itineraries found",""
"passed","Fri May 16 08:41:41 GMT 2025","Fri May 16 08:41:41 GMT 2025","9","ItineraryService","acceptItineraryInvitation","","","","should accept an itinerary invitation and link the user to the itinerary using itineraryId",""
"passed","Fri May 16 08:41:41 GMT 2025","Fri May 16 08:41:41 GMT 2025","4","ItineraryController","searchItineraries","","","","should search itineraries with day count range filters",""
"passed","Fri May 16 08:41:41 GMT 2025","Fri May 16 08:41:41 GMT 2025","6","ItineraryService","_checkContingencyCount","","","","should return 0 when there are no contingency plans",""
"passed","Fri May 16 08:41:44 GMT 2025","Fri May 16 08:41:44 GMT 2025","3","TourController","getSearchSuggestions","","","","should return empty suggestions for short queries",""
"passed","Fri May 16 08:41:43 GMT 2025","Fri May 16 08:41:43 GMT 2025","3","ProfileController","getListItineraryLikes","","","","should return itinerary likes when getListItineraryLikes is called with a valid ID",""
"passed","Fri May 16 08:41:43 GMT 2025","Fri May 16 08:41:43 GMT 2025","4","PreRegisterService","validateLogin","","","","should throw UnauthorizedException for invalid ticket",""
"passed","Fri May 16 08:41:42 GMT 2025","Fri May 16 08:41:42 GMT 2025","5","AuthService","clearExpiredRefreshTokens","","","","should delete expired refresh tokens",""
"passed","Fri May 16 08:41:41 GMT 2025","Fri May 16 08:41:41 GMT 2025","3","MeilisearchService","formatItineraryForIndex","","","","should handle missing fields gracefully",""
"passed","Fri May 16 08:41:41 GMT 2025","Fri May 16 08:41:41 GMT 2025","2","ItineraryController","removeUserFromItinerary","","","","should remove a user from an itinerary and return a formatted response",""
"passed","Fri May 16 08:41:45 GMT 2025","Fri May 16 08:41:45 GMT 2025","2","MapService","getPlaceDetails","","","","should return place details with price range when successful",""
"passed","Fri May 16 08:41:41 GMT 2025","Fri May 16 08:41:41 GMT 2025","2","ItineraryController","selectContingency","","","","should throw NotFoundException if contingency not found",""
"passed","Fri May 16 08:41:42 GMT 2025","Fri May 16 08:41:42 GMT 2025","4","AuthService","refreshToken","","","","should throw UnauthorizedException if refresh token is blacklisted",""
"passed","Fri May 16 08:41:41 GMT 2025","Fri May 16 08:41:41 GMT 2025","6","ItineraryController","getSearchSuggestions","","","","should handle duplicate titles in results",""
"passed","Fri May 16 08:41:41 GMT 2025","Fri May 16 08:41:41 GMT 2025","5","ItineraryController","findContingencies","","","","should throw ForbiddenException if user is not authorized",""
"passed","Fri May 16 08:41:41 GMT 2025","Fri May 16 08:41:41 GMT 2025","3","ItineraryService","duplicateContingency","","","","should throw NotFoundException if itinerary does not exist",""
"passed","Fri May 16 08:41:41 GMT 2025","Fri May 16 08:41:41 GMT 2025","6","ItineraryService","removeUserFromItinerary","","","","should throw NotFoundException if the user to be removed is not a participant",""
"passed","Fri May 16 08:41:41 GMT 2025","Fri May 16 08:41:41 GMT 2025","132","ItineraryService","","","","","should be defined",""
"passed","Fri May 16 08:41:42 GMT 2025","Fri May 16 08:41:42 GMT 2025","3","AuthService","resetPassword","","","","should throw BadRequestException if user's email is not registered",""
"passed","Fri May 16 08:41:43 GMT 2025","Fri May 16 08:41:43 GMT 2025","3","ProfileController","getTransactionHistory","","","","should handle NotFoundException if service throws it",""
"passed","Fri May 16 08:41:41 GMT 2025","Fri May 16 08:41:41 GMT 2025","3","ItineraryService","createContingencyPlan","","","","should throw NotFoundException if itinerary does not exist",""
"passed","Fri May 16 08:41:43 GMT 2025","Fri May 16 08:41:43 GMT 2025","2","ProfileController","getListItineraryLikes","","","","should return empty array when user has no itinerary likes",""
"passed","Fri May 16 08:41:41 GMT 2025","Fri May 16 08:41:41 GMT 2025","3","ItineraryService","searchItineraries","","","","should search itineraries with filters",""
"passed","Fri May 16 08:41:41 GMT 2025","Fri May 16 08:41:41 GMT 2025","8","ItineraryController","getSearchSuggestions","","","","should limit suggestions to top 5 results",""
"passed","Fri May 16 08:41:41 GMT 2025","Fri May 16 08:41:41 GMT 2025","3","MeilisearchService","formatTourForIndex","","","","should handle missing fields gracefully",""
"passed","Fri May 16 08:41:44 GMT 2025","Fri May 16 08:41:44 GMT 2025","11","AuthGuard","","","","","should allow access if token is valid",""
"passed","Fri May 16 08:41:41 GMT 2025","Fri May 16 08:41:41 GMT 2025","4","ItineraryService","createItinerary","","","","should handle empty createdBlocks and use default TRANSPORT_MODE.DRIVE when transportMode is not provided",""
"passed","Fri May 16 08:41:44 GMT 2025","Fri May 16 08:41:44 GMT 2025","18","GeminiService","","","","","should be defined",""
"passed","Fri May 16 08:41:40 GMT 2025","Fri May 16 08:41:40 GMT 2025","2","ProfileService","updateProfile","","","","should only update specified fields",""
"passed","Fri May 16 08:41:41 GMT 2025","Fri May 16 08:41:41 GMT 2025","9","ItineraryService","findOneItinerary","","","","should return itinerary when found and user has access to it",""
"passed","Fri May 16 08:41:41 GMT 2025","Fri May 16 08:41:41 GMT 2025","4","ItineraryService","createItinerary","","","","should create routes across multiple sections",""
"passed","Fri May 16 08:41:41 GMT 2025","Fri May 16 08:41:41 GMT 2025","5","ItineraryController","createItinerary","","","","should pass errors from service to the caller",""
"passed","Fri May 16 08:41:40 GMT 2025","Fri May 16 08:41:40 GMT 2025","3","ProfileService","getTransactionHistory","","","","should return an empty array when user has no transactions",""
"passed","Fri May 16 08:41:44 GMT 2025","Fri May 16 08:41:44 GMT 2025","5","UmamiService","_getPreviousMonthRange","","","","should return the correct start and end timestamps for the previous month",""
"passed","Fri May 16 08:41:41 GMT 2025","Fri May 16 08:41:41 GMT 2025","2","ItineraryController","updateContingency","","","","should throw ForbiddenException if user is not authorized",""
"passed","Fri May 16 08:41:44 GMT 2025","Fri May 16 08:41:44 GMT 2025","4","AuthController","login","","","","should throw UnauthorizedException if email is not registered",""
"passed","Fri May 16 08:41:42 GMT 2025","Fri May 16 08:41:42 GMT 2025","3","ItineraryService","saveItinerary","","","","should throw ForbiddenException if user doesnt have access to itinerary",""
"passed","Fri May 16 08:41:45 GMT 2025","Fri May 16 08:41:45 GMT 2025","3","PaymentController","update","","","","should update a payment",""
"passed","Fri May 16 08:41:45 GMT 2025","Fri May 16 08:41:45 GMT 2025","3","MapService","getPriceRangeByPlaceId","","","","should handle missing price range data",""
"passed","Fri May 16 08:41:41 GMT 2025","Fri May 16 08:41:41 GMT 2025","5","ItineraryController","acceptItineraryInvitation","","","","should throw ForbiddenException if the user is not authorized to accept the invitation",""
"passed","Fri May 16 08:41:42 GMT 2025","Fri May 16 08:41:42 GMT 2025","6","AuthService","sendPasswordResetVerification","","","","should send password reset verification email if user exists and has email registered",""
"passed","Fri May 16 08:41:42 GMT 2025","Fri May 16 08:41:42 GMT 2025","2","NotificationService","_formatReminderOption","","","","should return ""tidak diketahui"" for unknown option",""
"passed","Fri May 16 08:41:42 GMT 2025","Fri May 16 08:41:42 GMT 2025","150","AuthService","register","","","","should throw NotFoundException if user is not found",""
"passed","Fri May 16 08:41:41 GMT 2025","Fri May 16 08:41:41 GMT 2025","3","ItineraryController","updateItinerary","","","","should update an itinerary and return a formatted response",""
"passed","Fri May 16 08:41:41 GMT 2025","Fri May 16 08:41:41 GMT 2025","3","ItineraryController","findAllMyItineraries","","","","should return all itineraries with default parameters",""
"passed","Fri May 16 08:41:43 GMT 2025","Fri May 16 08:41:43 GMT 2025","3","PreRegisterService","getReferralCode","","","","should throw BadRequestException if user is not found",""
"passed","Fri May 16 08:41:41 GMT 2025","Fri May 16 08:41:41 GMT 2025","2","MeilisearchService","searchItineraries","","","","should search itineraries with the provided query and options",""
"passed","Fri May 16 08:41:45 GMT 2025","Fri May 16 08:41:45 GMT 2025","15","PaymentController","","","","","should be defined",""
"passed","Fri May 16 08:41:41 GMT 2025","Fri May 16 08:41:41 GMT 2025","4","ItineraryService","findContingencyPlan","","","","should return a contingency plan with correctly mapped section numbers",""
"passed","Fri May 16 08:41:41 GMT 2025","Fri May 16 08:41:41 GMT 2025","3","ItineraryController","duplicateItineraryAndContingencies","","","","should duplicate an itinerary with no contingencies and return a formatted response",""
"passed","Fri May 16 08:41:45 GMT 2025","Fri May 16 08:41:45 GMT 2025","6","PaymentController","findOne","","","","should return a single payment",""
"passed","Fri May 16 08:41:41 GMT 2025","Fri May 16 08:41:41 GMT 2025","3","ItineraryController","publishItinerary","","","","should throw BadRequestException if already published",""
"passed","Fri May 16 08:41:45 GMT 2025","Fri May 16 08:41:45 GMT 2025","2","PaymentService","findOne","","","","should return a string indicating a specific payment was returned",""
"passed","Fri May 16 08:41:41 GMT 2025","Fri May 16 08:41:41 GMT 2025","4","ItineraryService","removeItinerary","","","","should throw ForbiddenException when user is not the owner of the itinerary",""
"passed","Fri May 16 08:41:45 GMT 2025","Fri May 16 08:41:45 GMT 2025","9","RefreshStrategy","","","","","should be defined",""
"passed","Fri May 16 08:41:41 GMT 2025","Fri May 16 08:41:41 GMT 2025","9","ItineraryController","removeItinerary","","","","should call remove() in the service and delete an itinerary",""
"passed","Fri May 16 08:41:41 GMT 2025","Fri May 16 08:41:41 GMT 2025","4","ItineraryController","createItinerary","","","","should handle optional fields in the DTO correctly",""
"passed","Fri May 16 08:41:42 GMT 2025","Fri May 16 08:41:42 GMT 2025","2","NotificationService","update","","","","should throw NotFoundException if itinerary doesnt exist",""
"passed","Fri May 16 08:41:44 GMT 2025","Fri May 16 08:41:44 GMT 2025","3","AuthController","resetPassword","","","","should call authService.resetPassword with correct data",""
"passed","Fri May 16 08:41:41 GMT 2025","Fri May 16 08:41:41 GMT 2025","8","ItineraryController","removeUserFromItinerary","","","","should throw NotFoundException if the user to be removed does not exist",""
"passed","Fri May 16 08:41:44 GMT 2025","Fri May 16 08:41:44 GMT 2025","14","PreRegisterService","sendDiscordWebhook","","","","should send webhook for pre-registration",""
"passed","Fri May 16 08:41:41 GMT 2025","Fri May 16 08:41:41 GMT 2025","7","ItineraryService","findOneItinerary","","","","should allow user to see itinerary if invited",""
"passed","Fri May 16 08:41:43 GMT 2025","Fri May 16 08:41:43 GMT 2025","2","ProfileController","changePassword","","","","should return success response when password change is successful",""
"passed","Fri May 16 08:41:41 GMT 2025","Fri May 16 08:41:41 GMT 2025","6","ItineraryService","createViewItinerary","","","","should delete oldest view if already 10 and add new",""
"passed","Fri May 16 08:41:45 GMT 2025","Fri May 16 08:41:45 GMT 2025","19","StaticService","","","","","should be defined",""
"passed","Fri May 16 08:41:41 GMT 2025","Fri May 16 08:41:41 GMT 2025","6","ItineraryController","batchCheckUserSavedItinerary","","","","should check saved status of public itinerary ids for the user and return success response",""
"passed","Fri May 16 08:41:41 GMT 2025","Fri May 16 08:41:41 GMT 2025","2","ItineraryService","findMyItineraries","","","","should handle overflow page numbers",""
"passed","Fri May 16 08:41:41 GMT 2025","Fri May 16 08:41:41 GMT 2025","5","ItineraryService","updateItinerary","","","","should throw NotFoundException when tags do not exist",""
"passed","Fri May 16 08:41:41 GMT 2025","Fri May 16 08:41:41 GMT 2025","3","ItineraryController","publishItinerary","","","","should publish an itinerary and return success response",""
"passed","Fri May 16 08:41:40 GMT 2025","Fri May 16 08:41:40 GMT 2025","3","ProfileService","updatePhotoProfile","","","","should successfully update user photo profile",""
"passed","Fri May 16 08:41:43 GMT 2025","Fri May 16 08:41:43 GMT 2025","35","PreRegisterService","createPreRegister","","","","should create a new user and send confirmation email",""
"passed","Fri May 16 08:41:40 GMT 2025","Fri May 16 08:41:40 GMT 2025","3","ProfileService","getListItineraries","","","","should correctly calculate totalDestinations when sections is empty",""
"passed","Fri May 16 08:41:41 GMT 2025","Fri May 16 08:41:41 GMT 2025","7","ItineraryService","findMyCompletedItineraries","","","","should correctly count LOCATION blocks",""
"passed","Fri May 16 08:41:41 GMT 2025","Fri May 16 08:41:41 GMT 2025","9","ItineraryController","findMySharedItineraries","","","","should return shared itineraries successfully",""
"passed","Fri May 16 08:41:42 GMT 2025","Fri May 16 08:41:42 GMT 2025","3","TourService","findOne","","","","should return tour with null itinerary if itinerary not found",""
"passed","Fri May 16 08:41:43 GMT 2025","Fri May 16 08:41:43 GMT 2025","5","ProfileController","updatePhotoProfile","","","","should call updatePhotoProfile service with correct parameters",""
"passed","Fri May 16 08:41:43 GMT 2025","Fri May 16 08:41:43 GMT 2025","3","PreRegisterService","_generateTicket","","","","should create a new ticket for the user",""
"passed","Fri May 16 08:41:40 GMT 2025","Fri May 16 08:41:40 GMT 2025","3","ProfileService","changePassword","","","","should throw BadRequestException when new password and confirmation do not match",""
"passed","Fri May 16 08:41:42 GMT 2025","Fri May 16 08:41:42 GMT 2025","3","AuthService","createUser","","","","should create a new user if user does not exist",""
"passed","Fri May 16 08:41:44 GMT 2025","Fri May 16 08:41:44 GMT 2025","3","TourController","getTourView","","","","should call service and return viewed tours",""
"passed","Fri May 16 08:41:41 GMT 2025","Fri May 16 08:41:41 GMT 2025","3","ItineraryService","createViewItinerary","","","","should throw NotFoundException if tour doesnt exist",""
"passed","Fri May 16 08:41:45 GMT 2025","Fri May 16 08:41:45 GMT 2025","21","PreRegisterController","","","","","should be defined",""
"passed","Fri May 16 08:41:45 GMT 2025","Fri May 16 08:41:45 GMT 2025","2","PaymentService","remove","","","","should return a string indicating a payment was removed",""
"passed","Fri May 16 08:41:45 GMT 2025","Fri May 16 08:41:45 GMT 2025","2","PreRegisterController","validateLogin","","","","should call service.validateLogin with correct ticketId",""
"passed","Fri May 16 08:41:42 GMT 2025","Fri May 16 08:41:42 GMT 2025","7","TourService","findOne","","","","should return tour with itinerary when found",""
"passed","Fri May 16 08:41:43 GMT 2025","Fri May 16 08:41:43 GMT 2025","3","NotificationController","findOne","","","","should fetch an itinerary reminder and return OK when found",""
"passed","Fri May 16 08:41:41 GMT 2025","Fri May 16 08:41:41 GMT 2025","4","ItineraryController","findAllTags","","","","should return all tags",""
"passed","Fri May 16 08:41:41 GMT 2025","Fri May 16 08:41:41 GMT 2025","5","MeilisearchService","addOrUpdateTour","","","","should add a tour to the index",""
"passed","Fri May 16 08:41:41 GMT 2025","Fri May 16 08:41:41 GMT 2025","3","ItineraryController","findAllMyItineraries","","","","should filter itineraries with shared=true and finished=true",""
"passed","Fri May 16 08:41:42 GMT 2025","Fri May 16 08:41:42 GMT 2025","6","ItineraryService","unsaveItinerary","","","","should throw NotFoundException if itinerary does not exist",""
"passed","Fri May 16 08:41:43 GMT 2025","Fri May 16 08:41:43 GMT 2025","2","PreRegisterService","getReferralCode","","","","should return user referral code and count",""
"passed","Fri May 16 08:41:41 GMT 2025","Fri May 16 08:41:41 GMT 2025","3","ItineraryService","updateItinerary","","","","should throw BadRequestException when block start time is after end time",""
"passed","Fri May 16 08:41:42 GMT 2025","Fri May 16 08:41:42 GMT 2025","2","ItineraryService","batchCheckUserSavedItinerary","","","","should return empty array if the list is empty",""
"passed","Fri May 16 08:41:41 GMT 2025","Fri May 16 08:41:41 GMT 2025","3","ItineraryController","markAsComplete","","","","should mark itinerary as complete",""
"passed","Fri May 16 08:41:40 GMT 2025","Fri May 16 08:41:40 GMT 2025","3","ProfileService","verifyEmailChange","","","","should propagate errors from _verifyChangeEmailTicket",""
"passed","Fri May 16 08:41:40 GMT 2025","Fri May 16 08:41:40 GMT 2025","2","ProfileService","_generateChangeEmailTicket","","","","should throw BadRequestException when requesting too soon",""
"passed","Fri May 16 08:41:41 GMT 2025","Fri May 16 08:41:41 GMT 2025","3","ItineraryService","findAllMyItineraries","","","","should return paginated itineraries for both owned and shared when sharedBool is false",""
"passed","Fri May 16 08:41:41 GMT 2025","Fri May 16 08:41:41 GMT 2025","3","ItineraryService","duplicateContingency","","","","should duplicate an itinerary contingency",""
"passed","Fri May 16 08:41:45 GMT 2025","Fri May 16 08:41:45 GMT 2025","2","PaymentController","findAll","","","","should return an array of payments",""
"passed","Fri May 16 08:41:41 GMT 2025","Fri May 16 08:41:41 GMT 2025","5","ItineraryController","findAllMyItineraries","","","","should filter itineraries with shared=false and finished=false",""
"passed","Fri May 16 08:41:41 GMT 2025","Fri May 16 08:41:41 GMT 2025","2","MeilisearchService","addOrUpdateItinerary","","","","should delete an unpublished itinerary from the index",""
"passed","Fri May 16 08:41:43 GMT 2025","Fri May 16 08:41:43 GMT 2025","9","ProfileController","getTransactionHistory","","","","should return transaction history when getTransactionHistory is called with a valid ID",""
"passed","Fri May 16 08:41:44 GMT 2025","Fri May 16 08:41:44 GMT 2025","3","AuthController","requestPasswordReset","","","","should call authService.sendPasswordResetVerification with correct data",""
"passed","Fri May 16 08:41:41 GMT 2025","Fri May 16 08:41:41 GMT 2025","5","ItineraryService","findOneItinerary","","","","should throw ForbiddenException if user is not authorized",""
"passed","Fri May 16 08:41:44 GMT 2025","Fri May 16 08:41:44 GMT 2025","7","PreRegisterService","sendDiscordWebhook","","","","should handle errors if fetch fails",""
"passed","Fri May 16 08:41:41 GMT 2025","Fri May 16 08:41:41 GMT 2025","2","ItineraryController","findMyItineraries","","","","should return empty data when there are no itineraries",""
"passed","Fri May 16 08:41:45 GMT 2025","Fri May 16 08:41:45 GMT 2025","2","StaticService","_getCountryCode","","","","should return country details based on placeId",""
"passed","Fri May 16 08:41:41 GMT 2025","Fri May 16 08:41:41 GMT 2025","3","ItineraryService","createItinerary","","","","should not create route when routeToNext is undefined or null",""
"passed","Fri May 16 08:41:41 GMT 2025","Fri May 16 08:41:41 GMT 2025","27","ItineraryController","publishItinerary","","","","should throw ForbiddenException if user is not owner",""
"passed","Fri May 16 08:41:41 GMT 2025","Fri May 16 08:41:41 GMT 2025","6","ItineraryController","searchItineraries","","","","should search itineraries with combined filters and custom sorting",""
"passed","Fri May 16 08:41:43 GMT 2025","Fri May 16 08:41:43 GMT 2025","3","NotificationController","createAndSchedule","","","","should create an itinerary reminder and schedule the cron job",""
"passed","Fri May 16 08:41:41 GMT 2025","Fri May 16 08:41:41 GMT 2025","3","ItineraryController","findMyCompletedItineraries","","","","should return completed itineraries with response formatting",""
"passed","Fri May 16 08:41:41 GMT 2025","Fri May 16 08:41:41 GMT 2025","3","ItineraryService","duplicateItinerary","","","","should throw ForbiddenException if user does not own the itinerary and the itinerary is not public",""
"passed","Fri May 16 08:41:45 GMT 2025","Fri May 16 08:41:45 GMT 2025","2","StaticController","getCountries","","","","should return list of countries",""
"passed","Fri May 16 08:41:41 GMT 2025","Fri May 16 08:41:41 GMT 2025","3","ItineraryController","inviteToItinerary","","","","should invite a user to an itinerary and return a formatted response",""
"passed","Fri May 16 08:41:41 GMT 2025","Fri May 16 08:41:41 GMT 2025","5","ItineraryService","publishItinerary","","","","should throw ForbiddenException if user is not the owner",""
"passed","Fri May 16 08:41:45 GMT 2025","Fri May 16 08:41:45 GMT 2025","10","EmailService","","","","","should be defined",""
"passed","Fri May 16 08:41:45 GMT 2025","Fri May 16 08:41:45 GMT 2025","4","PaginationDto","","","","","should return validation error if page is negative",""
"passed","Fri May 16 08:41:41 GMT 2025","Fri May 16 08:41:41 GMT 2025","8","ItineraryController","getViewItinerary","","","","should call service and return viewed itineraries",""
"passed","Fri May 16 08:41:42 GMT 2025","Fri May 16 08:41:42 GMT 2025","3","AuthService","register","","","","should throw BadRequestException if passwords do not match",""
"passed","Fri May 16 08:41:41 GMT 2025","Fri May 16 08:41:41 GMT 2025","3","ItineraryService","createItinerary","","","","should handle when section is not found in the created itinerary",""
"passed","Fri May 16 08:41:43 GMT 2025","Fri May 16 08:41:43 GMT 2025","3","ProfileController","getListItineraries","","","","should return itineraries when getListItineraries is called with a valid ID",""
"passed","Fri May 16 08:41:43 GMT 2025","Fri May 16 08:41:43 GMT 2025","2","ProfileController","changePassword","","","","should call changePassword service with correct parameters",""
"passed","Fri May 16 08:41:41 GMT 2025","Fri May 16 08:41:41 GMT 2025","7","ItineraryController","findContingencyById","","","","should return a specific contingency plan",""
"passed","Fri May 16 08:41:42 GMT 2025","Fri May 16 08:41:42 GMT 2025","7","AuthService","resetPassword","","","","should throw BadRequestException if passwords do not match",""
"passed","Fri May 16 08:41:41 GMT 2025","Fri May 16 08:41:41 GMT 2025","6","ItineraryService","removeItinerary","","","","should remove an itinerary successfully",""
"passed","Fri May 16 08:41:42 GMT 2025","Fri May 16 08:41:42 GMT 2025","5","AuthService","login","","","","should return access and refresh tokens if login is successful",""
"passed","Fri May 16 08:41:41 GMT 2025","Fri May 16 08:41:41 GMT 2025","2","MeilisearchService","calculateDaysCount","","","","should handle time components correctly",""
"passed","Fri May 16 08:41:41 GMT 2025","Fri May 16 08:41:41 GMT 2025","4","ItineraryService","markAsComplete","","","","should throw ForbiddenException if user is not the owner",""
"passed","Fri May 16 08:41:40 GMT 2025","Fri May 16 08:41:40 GMT 2025","3","ProfileService","changePassword","","","","should throw BadRequestException when new password is same as old password",""
"passed","Fri May 16 08:41:41 GMT 2025","Fri May 16 08:41:41 GMT 2025","5","ItineraryController","createViewItinerary","","","","should call service and return response",""
"passed","Fri May 16 08:41:42 GMT 2025","Fri May 16 08:41:42 GMT 2025","4","ItineraryService","findItinerariesByLatestTags","","","","should find itineraries by tags from user's latest and recently viewed itineraries",""
"passed","Fri May 16 08:41:42 GMT 2025","Fri May 16 08:41:42 GMT 2025","32","NotificationService","","","","","should be defined",""
"passed","Fri May 16 08:41:41 GMT 2025","Fri May 16 08:41:41 GMT 2025","5","ItineraryController","createItinerary","","","","should create an itinerary and return a formatted response",""
"passed","Fri May 16 08:41:42 GMT 2025","Fri May 16 08:41:42 GMT 2025","1","TourService","searchTours","","","","should search tours with filters and pagination",""
"passed","Fri May 16 08:41:42 GMT 2025","Fri May 16 08:41:42 GMT 2025","3","TourService","createTourView","","","","should throw NotFoundException if tour doesnt exist",""
"passed","Fri May 16 08:41:42 GMT 2025","Fri May 16 08:41:42 GMT 2025","2","NotificationService","_formatReminderOption","","","","should return ""1 jam"" for ONE_HOUR_BEFORE option",""
