"Status","Start Time","Stop Time","Duration in ms","Parent Suite","Suite","Sub Suite","Test Class","Test Method","Name","Description"
"passed","Fri May 16 08:41:41 GMT 2025","Fri May 16 08:41:41 GMT 2025","7","ItineraryService","createContingencyPlan","","","","should create a contingency plan with sections and blocks",""
"passed","Fri May 16 08:41:44 GMT 2025","Fri May 16 08:41:44 GMT 2025","2","GeminiService","createPrompt","","","","should format dates according to Indonesian time format",""
"passed","Fri May 16 08:41:40 GMT 2025","Fri May 16 08:41:40 GMT 2025","2","ProfileService","updateProfile","","","","should update user profile with valid data",""
"passed","Fri May 16 08:41:43 GMT 2025","Fri May 16 08:41:43 GMT 2025","5","NotificationController","updateAndReschedule","","","","should update an itinerary reminder and reschdule the cron job",""
"passed","Fri May 16 08:41:41 GMT 2025","Fri May 16 08:41:41 GMT 2025","5","ItineraryService","acceptItineraryInvitation","","","","should throw NotFoundException if itineraryId is not found when accepting an invitation",""
"passed","Fri May 16 08:41:43 GMT 2025","Fri May 16 08:41:43 GMT 2025","9","ProfileController","updateProfile","","","","should update a profile when called with valid ID and data",""
"passed","Fri May 16 08:41:41 GMT 2025","Fri May 16 08:41:41 GMT 2025","10","ItineraryService","createItinerary","","","","should create an itinerary with sections and blocks",""
"passed","Fri May 16 08:41:41 GMT 2025","Fri May 16 08:41:41 GMT 2025","18","ItineraryService","createItinerary","","","","should throw BadRequestException when duplicate section numbers are provided",""
"passed","Fri May 16 08:41:41 GMT 2025","Fri May 16 08:41:41 GMT 2025","4","ItineraryService","publishItinerary","","","","should unpublish the itinerary and remove from search index",""
"passed","Fri May 16 08:41:45 GMT 2025","Fri May 16 08:41:45 GMT 2025","3","MapController","","","","","should throw an error if placeId is not provided",""
"passed","Fri May 16 08:41:40 GMT 2025","Fri May 16 08:41:40 GMT 2025","3","ProfileService","getListItineraryLikes","","","","should correctly calculate totalDestinations when sections is empty",""
"passed","Fri May 16 08:41:40 GMT 2025","Fri May 16 08:41:40 GMT 2025","3","ProfileService","getTransactionHistory","","","","should include all transaction fields in the result",""
"passed","Fri May 16 08:41:41 GMT 2025","Fri May 16 08:41:41 GMT 2025","4","ItineraryController","findItinerariesByLatestTags","","","","should pass user object directly to service",""
"passed","Fri May 16 08:41:44 GMT 2025","Fri May 16 08:41:44 GMT 2025","3","UmamiService","getUmamiAnalytics","","","","should handle fetch errors gracefully",""
"passed","Fri May 16 08:41:42 GMT 2025","Fri May 16 08:41:42 GMT 2025","3","NotificationService","remove","","","","should throw NotFoundException if itinerary doesnt exist",""
"passed","Fri May 16 08:41:41 GMT 2025","Fri May 16 08:41:41 GMT 2025","4","ItineraryController","findOne","","","","should throw NotFoundException if itinerary is not found",""
"passed","Fri May 16 08:41:40 GMT 2025","Fri May 16 08:41:40 GMT 2025","3","ProfileService","sendVerificationCode","","","","should successfully generate and send verification code",""
"passed","Fri May 16 08:41:41 GMT 2025","Fri May 16 08:41:41 GMT 2025","3","ItineraryService","_checkContingencyCount","","","","should throw BadRequestException when there are more than 2 contingency plans",""
"passed","Fri May 16 08:41:45 GMT 2025","Fri May 16 08:41:45 GMT 2025","5","AppController","root","","","","should return ""Hello World!""",""
"passed","Fri May 16 08:41:41 GMT 2025","Fri May 16 08:41:41 GMT 2025","5","ItineraryService","createItinerary","","","","should throw NotFoundException when tags do not exist",""
"passed","Fri May 16 08:41:41 GMT 2025","Fri May 16 08:41:41 GMT 2025","3","ItineraryService","createContingencyPlan","","","","should throw ForbiddenException if user does not own the itinerary",""
"passed","Fri May 16 08:41:41 GMT 2025","Fri May 16 08:41:41 GMT 2025","3","ItineraryController","searchItineraries","","","","should search itineraries with default parameters",""
"passed","Fri May 16 08:41:41 GMT 2025","Fri May 16 08:41:41 GMT 2025","88","MeilisearchService","formatItineraryForIndex","","","","should correctly format an itinerary for indexing",""
"passed","Fri May 16 08:41:44 GMT 2025","Fri May 16 08:41:44 GMT 2025","3","TourController","getSearchSuggestions","","","","should return tour title suggestions",""
"passed","Fri May 16 08:41:41 GMT 2025","Fri May 16 08:41:41 GMT 2025","4","ItineraryService","_checkContingencyCount","","","","should return 1 when there is one contingency plan",""
"passed","Fri May 16 08:41:41 GMT 2025","Fri May 16 08:41:41 GMT 2025","2","ItineraryController","getSearchSuggestions","","","","should return empty suggestions for short queries",""
"passed","Fri May 16 08:41:41 GMT 2025","Fri May 16 08:41:41 GMT 2025","3","ItineraryService","searchItineraries","","","","should search with custom sort parameters",""
"passed","Fri May 16 08:41:41 GMT 2025","Fri May 16 08:41:41 GMT 2025","6","ItineraryService","findOneItinerary","","","","should throw NotFoundException if itinerary does not exist",""
"passed","Fri May 16 08:41:45 GMT 2025","Fri May 16 08:41:45 GMT 2025","8","MapController","","","","","should return place details when placeId is valid",""
"passed","Fri May 16 08:41:44 GMT 2025","Fri May 16 08:41:44 GMT 2025","3","GeminiService","generateFeedback","","","","should parse JSON even if AI returns extra text",""
"passed","Fri May 16 08:41:41 GMT 2025","Fri May 16 08:41:41 GMT 2025","3","ItineraryService","updateItinerary","","","","should throw BadRequestException when date format is invalid",""
"passed","Fri May 16 08:41:41 GMT 2025","Fri May 16 08:41:41 GMT 2025","4","ItineraryController","removeUserFromItinerary","","","","should throw ForbiddenException if the user is not authorized to remove participants",""
"passed","Fri May 16 08:41:42 GMT 2025","Fri May 16 08:41:42 GMT 2025","6","ItineraryService","saveItinerary","","","","should save a public itinerary for the user",""
"passed","Fri May 16 08:41:41 GMT 2025","Fri May 16 08:41:41 GMT 2025","3","ItineraryService","findAllMyItineraries","","","","should throw an error when page number exceeds total pages",""
"passed","Fri May 16 08:41:45 GMT 2025","Fri May 16 08:41:45 GMT 2025","9","GeminiController","","","","","should be defined",""
"passed","Fri May 16 08:41:41 GMT 2025","Fri May 16 08:41:41 GMT 2025","8","ItineraryService","updateItinerary","","","","should throw ForbiddenException if user does not own the itinerary",""
"passed","Fri May 16 08:41:44 GMT 2025","Fri May 16 08:41:44 GMT 2025","8","GeminiService","generateFeedback","","","","should throw InternalServerErrorException on AI error",""
"passed","Fri May 16 08:41:41 GMT 2025","Fri May 16 08:41:41 GMT 2025","3","ItineraryController","createContingency","","","","should throw NotFoundException if itinerary not found",""
"passed","Fri May 16 08:41:41 GMT 2025","Fri May 16 08:41:41 GMT 2025","4","ItineraryService","publishItinerary","","","","should publish the itinerary if all checks pass",""
"passed","Fri May 16 08:41:41 GMT 2025","Fri May 16 08:41:41 GMT 2025","3","ItineraryService","duplicateContingency","","","","should throw NotFoundException if contingency does not exist",""
"passed","Fri May 16 08:41:41 GMT 2025","Fri May 16 08:41:41 GMT 2025","2","ItineraryController","acceptItineraryInvitation","","","","should throw NotFoundException if the invitation does not exist",""
"passed","Fri May 16 08:41:43 GMT 2025","Fri May 16 08:41:43 GMT 2025","29","ProfileController","","","","","should be defined",""
"passed","Fri May 16 08:41:40 GMT 2025","Fri May 16 08:41:40 GMT 2025","11","ProfileService","_verifyChangeEmailTicket","","","","should throw UnauthorizedException when ticket does not belong to the user",""
"passed","Fri May 16 08:41:41 GMT 2025","Fri May 16 08:41:41 GMT 2025","2","ItineraryController","unsaveItinerary","","","","should unsave the itinerary for the user",""
"passed","Fri May 16 08:41:45 GMT 2025","Fri May 16 08:41:45 GMT 2025","6","GeminiController","","","","","should throw an error if itineraryData.sections is empty",""
"passed","Fri May 16 08:41:44 GMT 2025","Fri May 16 08:41:44 GMT 2025","25","AuthGuard","","","","","should be defined",""
"passed","Fri May 16 08:41:41 GMT 2025","Fri May 16 08:41:41 GMT 2025","2","ItineraryService","findMyItineraries","","","","should return empty list if user has no itineraries",""
"passed","Fri May 16 08:41:41 GMT 2025","Fri May 16 08:41:41 GMT 2025","5","MeilisearchService","syncItineraries","","","","should not index if no published itineraries",""
"passed","Fri May 16 08:41:41 GMT 2025","Fri May 16 08:41:41 GMT 2025","3","ItineraryController","findItinerariesByLatestTags","","","","should return itineraries recommended based on user tags",""
"passed","Fri May 16 08:41:41 GMT 2025","Fri May 16 08:41:41 GMT 2025","4","ItineraryController","updateContingency","","","","should update a contingency plan and return a formatted response",""
"passed","Fri May 16 08:41:41 GMT 2025","Fri May 16 08:41:41 GMT 2025","3","ItineraryService","updateContingencyPlan","","","","should throw NotFoundException when contingency plan does not exist",""
"passed","Fri May 16 08:41:41 GMT 2025","Fri May 16 08:41:41 GMT 2025","7","ItineraryService","markAsComplete","","","","should throw NotFoundException if itinerary does not exist",""
"passed","Fri May 16 08:41:41 GMT 2025","Fri May 16 08:41:41 GMT 2025","3","ItineraryService","findMySharedItineraries","","","","should throw an error when page number exceeds total pages",""
"passed","Fri May 16 08:41:40 GMT 2025","Fri May 16 08:41:40 GMT 2025","7","ProfileService","findOne","","","","should return a user profile by id",""
"passed","Fri May 16 08:41:40 GMT 2025","Fri May 16 08:41:40 GMT 2025","3","ProfileService","sendVerificationCode","","","","should throw BadRequestException if email is already in use",""
