"Status","Start Time","Stop Time","Duration in ms","Parent Suite","Suite","Sub Suite","Test Class","Test Method","Name","Description"
"passed","Wed Apr 23 07:54:31 GMT 2025","Wed Apr 23 07:54:31 GMT 2025","5","ItineraryService","_checkContingencyCount","","","","should return 0 when there are no contingency plans",""
"passed","Wed Apr 23 07:54:32 GMT 2025","Wed Apr 23 07:54:32 GMT 2025","7","PreRegisterService","sendDiscordWebhook","","","","should send webhook for login-validation",""
"passed","Wed Apr 23 07:54:34 GMT 2025","Wed Apr 23 07:54:34 GMT 2025","3","AuthController","refreshToken","","","","should throw UnauthorizedException if refresh token is invalid",""
"passed","Wed Apr 23 07:54:32 GMT 2025","Wed Apr 23 07:54:32 GMT 2025","3","ItineraryController","findContingencies","","","","should throw NotFoundException if itinerary not found",""
"passed","Wed Apr 23 07:54:32 GMT 2025","Wed Apr 23 07:54:32 GMT 2025","2","ItineraryController","searchItineraries","","","","should search itineraries with tags filter",""
"passed","Wed Apr 23 07:54:31 GMT 2025","Wed Apr 23 07:54:31 GMT 2025","5","ItineraryService","findOneItinerary","","","","should allow user to see itinerary if invited",""
"passed","Wed Apr 23 07:54:35 GMT 2025","Wed Apr 23 07:54:35 GMT 2025","2","PaymentService","create","","","","should return a string indicating a new payment was added",""
"passed","Wed Apr 23 07:54:33 GMT 2025","Wed Apr 23 07:54:33 GMT 2025","2","GeminiService","createPrompt","","","","should format dates according to Indonesian time format",""
"passed","Wed Apr 23 07:54:34 GMT 2025","Wed Apr 23 07:54:34 GMT 2025","2","ProfileController","findAll","","","","should return an array of profiles",""
"passed","Wed Apr 23 07:54:31 GMT 2025","Wed Apr 23 07:54:31 GMT 2025","5","ItineraryService","findAllMyItineraries","","","","should throw an error when page number exceeds total pages",""
"passed","Wed Apr 23 07:54:31 GMT 2025","Wed Apr 23 07:54:31 GMT 2025","5","ItineraryService","findMySharedItineraries","","","","should return itineraries shared with the user",""
"passed","Wed Apr 23 07:54:32 GMT 2025","Wed Apr 23 07:54:32 GMT 2025","4","PreRegisterService","sendDiscordWebhook","","","","should not send webhook if DISCORD_WEBHOOK_URL is not set",""
"passed","Wed Apr 23 07:54:32 GMT 2025","Wed Apr 23 07:54:32 GMT 2025","8","NotificationController","removeAndCancel","","","","should remove an itinerary reminder and cancel the cron job",""
"passed","Wed Apr 23 07:54:33 GMT 2025","Wed Apr 23 07:54:33 GMT 2025","3","AuthGuard","","","","","should allow access if token is valid",""
"passed","Wed Apr 23 07:54:31 GMT 2025","Wed Apr 23 07:54:31 GMT 2025","2","ItineraryService","_checkContingencyCount","","","","should return 1 when there is one contingency plan",""
"passed","Wed Apr 23 07:54:31 GMT 2025","Wed Apr 23 07:54:31 GMT 2025","3","ItineraryService","findAllMyItineraries","","","","should return only shared itineraries when sharedBool is true",""
"passed","Wed Apr 23 07:54:31 GMT 2025","Wed Apr 23 07:54:31 GMT 2025","3","ItineraryService","createItinerary","","","","should throw BadRequestException when no sections are provided",""
"passed","Wed Apr 23 07:54:34 GMT 2025","Wed Apr 23 07:54:34 GMT 2025","2","ProfileController","findOne","","","","should return a single profile",""
"passed","Wed Apr 23 07:54:32 GMT 2025","Wed Apr 23 07:54:32 GMT 2025","12","PreRegisterService","sendDiscordWebhook","","","","should send webhook for pre-registration",""
"passed","Wed Apr 23 07:54:34 GMT 2025","Wed Apr 23 07:54:34 GMT 2025","12","StaticService","","","","","should be defined",""
"passed","Wed Apr 23 07:54:30 GMT 2025","Wed Apr 23 07:54:30 GMT 2025","6","NotificationService","_formatReminderOption","","","","should return ""1 jam"" for ONE_HOUR_BEFORE option",""
"passed","Wed Apr 23 07:54:31 GMT 2025","Wed Apr 23 07:54:31 GMT 2025","3","AuthService","clearExpiredRefreshTokens","","","","should delete expired refresh tokens",""
"passed","Wed Apr 23 07:54:32 GMT 2025","Wed Apr 23 07:54:32 GMT 2025","5","MeilisearchService","addOrUpdateItinerary","","","","should add a published itinerary to the index",""
"passed","Wed Apr 23 07:54:33 GMT 2025","Wed Apr 23 07:54:33 GMT 2025","17","MapService","getPlaceDetails","","","","should throw an error if placeId is not provided",""
"passed","Wed Apr 23 07:54:34 GMT 2025","Wed Apr 23 07:54:34 GMT 2025","3","TicketController","update","","","","should update a ticket",""
"passed","Wed Apr 23 07:54:34 GMT 2025","Wed Apr 23 07:54:34 GMT 2025","15","MeilisearchController","","","","","should be defined",""
"passed","Wed Apr 23 07:54:30 GMT 2025","Wed Apr 23 07:54:30 GMT 2025","7","NotificationService","remove","","","","should throw NotFoundException if itinerary doesnt exist",""
"passed","Wed Apr 23 07:54:35 GMT 2025","Wed Apr 23 07:54:35 GMT 2025","9","EmailService","","","","","should be defined",""
"passed","Wed Apr 23 07:54:31 GMT 2025","Wed Apr 23 07:54:31 GMT 2025","27","AuthService","login","","","","should throw UnauthorizedException if user is not found",""
"passed","Wed Apr 23 07:54:31 GMT 2025","Wed Apr 23 07:54:31 GMT 2025","3","ItineraryService","inviteToItinerary","","","","should send invitations to the provided emails",""
"passed","Wed Apr 23 07:54:31 GMT 2025","Wed Apr 23 07:54:31 GMT 2025","3","AuthService","createUser","","","","should throw BadRequestException if user was created recently and is not confirmed",""
"passed","Wed Apr 23 07:54:33 GMT 2025","Wed Apr 23 07:54:33 GMT 2025","16","UmamiService","getUmamiAnalytics","","","","should fetch analytics data and send to Discord",""
"passed","Wed Apr 23 07:54:32 GMT 2025","Wed Apr 23 07:54:32 GMT 2025","3","PreRegisterService","_generateTicket","","","","should create a new ticket for the user",""
"passed","Wed Apr 23 07:54:30 GMT 2025","Wed Apr 23 07:54:30 GMT 2025","6","NotificationService","findOne","","","","should return an itinerary reminder with associated itinerary id",""
"passed","Wed Apr 23 07:54:35 GMT 2025","Wed Apr 23 07:54:35 GMT 2025","3","EmailService","","","","","should handle errors if sending email fails",""
"passed","Wed Apr 23 07:54:34 GMT 2025","Wed Apr 23 07:54:34 GMT 2025","6","MeilisearchController","syncItineraries","","","","should throw UnauthorizedException when API key is missing",""
"passed","Wed Apr 23 07:54:31 GMT 2025","Wed Apr 23 07:54:32 GMT 2025","9","ItineraryController","findAllMyItineraries","","","","should filter itineraries with shared=false and finished=false",""
"passed","Wed Apr 23 07:54:33 GMT 2025","Wed Apr 23 07:54:33 GMT 2025","3","AuthGuard","","","","","should allow access if the route is public",""
"passed","Wed Apr 23 07:54:33 GMT 2025","Wed Apr 23 07:54:33 GMT 2025","3","UmamiService","getUmamiAnalytics","","","","should return 401 Unauthorized if UMAMI_API_KEY is not set",""
"passed","Wed Apr 23 07:54:32 GMT 2025","Wed Apr 23 07:54:32 GMT 2025","2","ItineraryService","selectContingencyPlan","","","","should throw ForbiddenException when contingency plan belongs to different itinerary",""
"passed","Wed Apr 23 07:54:31 GMT 2025","Wed Apr 23 07:54:31 GMT 2025","37","ItineraryService","createItinerary","","","","should throw BadRequestException when date format is invalid",""
"passed","Wed Apr 23 07:54:31 GMT 2025","Wed Apr 23 07:54:31 GMT 2025","3","AuthService","verify","","","","should throw UnauthorizedException if firstNames do not match",""
"passed","Wed Apr 23 07:54:29 GMT 2025","Wed Apr 23 07:54:29 GMT 2025","14","NotificationService","onModuleInit","","","","should reschedule itinerary reminders on server restart",""
"passed","Wed Apr 23 07:54:34 GMT 2025","Wed Apr 23 07:54:34 GMT 2025","2","TicketController","remove","","","","should remove a ticket",""
"passed","Wed Apr 23 07:54:33 GMT 2025","Wed Apr 23 07:54:33 GMT 2025","2","UmamiService","","","","","should log an error and return if UMAMI_DISCORD_WEBHOOK_URL is not set",""
"passed","Wed Apr 23 07:54:34 GMT 2025","Wed Apr 23 07:54:34 GMT 2025","8","PreRegisterController","referralCode","","","","should call service.getReferralCode with the correct userId",""
"passed","Wed Apr 23 07:54:32 GMT 2025","Wed Apr 23 07:54:32 GMT 2025","29","PreRegisterService","","","","","should be defined",""
"passed","Wed Apr 23 07:54:34 GMT 2025","Wed Apr 23 07:54:34 GMT 2025","3","StaticService","searchCities","","","","should return list of cities based on country",""
"passed","Wed Apr 23 07:54:32 GMT 2025","Wed Apr 23 07:54:32 GMT 2025","9","ItineraryController","findAllMyItineraries","","","","should handle service errors correctly",""
"passed","Wed Apr 23 07:54:32 GMT 2025","Wed Apr 23 07:54:32 GMT 2025","3","NotificationController","findOne","","","","should pass errors from service to the caller",""
"passed","Wed Apr 23 07:54:32 GMT 2025","Wed Apr 23 07:54:32 GMT 2025","48","NotificationController","","","","","should be defined",""
"passed","Wed Apr 23 07:54:31 GMT 2025","Wed Apr 23 07:54:31 GMT 2025","2","ItineraryService","_checkUpdateItineraryPermission","","","","should return the itinerary if user is the owner",""
"passed","Wed Apr 23 07:54:31 GMT 2025","Wed Apr 23 07:54:31 GMT 2025","3","AuthService","sendVerification","","","","should throw BadRequestException if requesting too fast",""
"passed","Wed Apr 23 07:54:31 GMT 2025","Wed Apr 23 07:54:31 GMT 2025","7","ItineraryService","updateItinerary","","","","should update an itinerary with new details, tags, sections, and blocks",""
